,title,pp,summary,total_jobs,total_hours,locality,country,perc_job_success,projects,skills_list
32,"Statistician, data analyst, & quantitative research consultant, PhD",$135.00/hr,"I'm a quantitative researcher/scientist who enjoys forming hypotheses, designing studies to test hypotheses, working with data, building statistical models, conducting statistical tests, and producing fully customized graphs/visualizations to show the results of quantitative research. I also enjoy creating computer simulations and building R Shiny apps. I usually do most of my work in R, though I also used Stata, Python, Excel, and SPSS in the past.

I did a PhD at Stony Brook University, where I conducted quantitative research in political psychology and political economics and where I received extensive training in statistics and methods of data analysis. My coursework included basic statistics and probability, experiment design, econometrics, linear and non-linear regression models (including binomial models, multinomial models, ordinal models, count models, censored and truncated models), maximum-likelihood estimation, time-series analysis, experiment design, causal inference, instrumental variables, regression discontinuity, structural equation modeling, factor analysis, game theory, computational modeling and simulations.

For several years I also taught university courses in math, statistics, and quantitative research methods for social science. I taught students how to use R, Stata, and Excel for data analysis. I taught both undergraduate students and doctoral students. 

I also have experience with publishing quantitative research in a peer-reviewed journal as a solo author.

In my freelance consulting work, I have advised clients on study design and statistical analysis for projects in many different fields of research, including psychology, sociology, economics, linguistics, mental health, medical treatment and recovery, business hiring practices, predictive modeling of asset prices, consumer preferences for market research, and others.

If you're interested in hiring me for a project, you should message me directly rather than invite me to apply for a job.

- James Cragun",95,"1,224",Eugene,,100,"['Review methodology and methods', 'Psychometrics for Credentialing Agency', 'Tutor - Quantitative Research Methods and Design', 'Statistician needed to assist with mixed methods dissertation.', 'Complex interaction models in R', 'Study Design/Sample Size Calculation/Statistics For Research Proposal', 'Initial Consultation Call', 'Survey analysis tutor', 'Dissertation Coach', '1 hour consultation on A/B testing significance testing', 'Qualtrics Survey Programming', 'Statistics/Math/Machine Learning Expert to create temp/humidity compensation function for sensor', 'Statistical consulting for predictive modeling', 'Math consulting', 'Statistical consulting', 'Checking data analysis', 'Data analysis consulting for travel/tourism data', 'Trial Design for Assessing Modes of Learning in Children', 'Stats Tutor: Regression & Two Way Fixed Effects', 'Simulating play-by-play for NFL games using nflfastR']","['Data Analysis', 'R', 'Microsoft Excel', 'Mathematical Modeling', 'Statistics', 'Experiment Design', 'Quantitative Research', 'Regression Analysis', 'Research Methods', 'Linear Regression', 'Logistic Regression', 'Survey Design', 'Survey Data Analysis', 'Qualtrics', 'Causal Inference']"
33,Looker Studio Guru | Marketing Analytics Specialist | Data Analyst,$25.00/hr,"⭐ TOP-RATED PROFESSIONAL with extensive experience in DATA VISUALIZATION and DASHBOARD DEVELOPMENT
⭐ Expert in Looker Studio, Google Sheets,Google Analytics (GA4), and various E-COMMERCE PLATFORMS
⭐ Proven track record of creating impactful, data-driven dashboards for optimized decision-making

📊 CORE SKILLS & EXPERTISE
I am a seasoned Data Analyst and Dashboard Developer with a focus on transforming complex data into clear, actionable insights. With my extensive experience, I specialize in creating automated dashboards and visualizations that drive business growth and enhance performance tracking.

My expertise spans a broad range of platforms and tools, enabling me to deliver comprehensive analytics solutions tailored to your business needs.

Key Competencies:

Data Visualization: Mastery in developing compelling and intuitive dashboards using Looker Studio, tailored to visualize data from multiple sources including Google Sheets, Amazon Seller Central, and Shopify.
E-Commerce & Advertising Analytics: Proficient in integrating and analyzing data from e-commerce platforms like Shopify and Amazon, as well as advertising channels including Google Ads, Facebook Ads, and Instagram Ads.
Web Analytics & CRM Integration: Expertise in Google Analytics (UA/GA4), HubSpot, and LinkedIn, providing a holistic view of your marketing performance.
Business Intelligence & Automation: Skilled in automating data flows and creating efficient reporting systems, leveraging tools like MySQL and Google Maps for enhanced data contextualization.
⚒️ TOOLS & TECHNOLOGIES
I am adept at using a wide array of tools and platforms to ensure seamless data integration, blending, and visualization. Some of the key tools I work with include:

Looker Studio & Looker ML
Google sheets reports and Automation
Google Analytics (UA/GA4)
Amazon Seller Central & Ads
Google Ads & Facebook Ads
HubSpot & LinkedIn
Google Sheets, Google Forms
📑 AUTOMATED BUSINESS REPORTING & ANALYSIS
I specialize in developing automated reports that provide deep insights into various business metrics, helping you make informed, data-driven decisions. My experience includes:

Sales & Revenue Forecasting: Implementing advanced statistical and machine learning models to predict sales trends and optimize revenue generation.
Performance Tracking: Building dashboards that monitor key performance indicators (KPIs) across marketing, sales, and customer engagement.
🔍 DATA SOURCE INTEGRATIONS
My skillset includes integrating data from multiple sources to provide a unified view of your business operations. This includes blending data from Google Sheets, Amazon Seller Central, Shopify, and various CRM platforms.

Let's collaborate to transform your data into powerful visualizations that drive business success. Reach out today to see how I can help you achieve your goals.",63,"1,117",Peshawar,Pakistan,100,"['Sales Data Report in Looker Studio', 'Google Tags Script', 'SuperMetrics For Shopify, Facebook and Google Ads', 'Looker Studio Dashboards', 'Automate Profit Tracking for Shopify and Facebook Ads', 'Looker studio mission', '30 minute consultation', 'Build Google Data Studio reports for PPC / SEO Agency', 'Looker I ClickUp I Airtable I Data Analysis', 'data sheets', 'Looker Studio Expert', 'Dashboard from the huge JSON file.', 'Looker Studio Expert Needed for Ongoing Projects', 'Shopify & Google Analytics Data Analyst', 'Google Looker Studio - Amazon Dashboard Set-up', '📊 Looker Studio/Google Sheets Expert To Help Automate Analytics Reports', 'Data Studio Ninja Expert Black-Belt', 'Build Looker Studio Dashboard with Google Sheets Data', 'Need Google Looker Studio Guru', 'Looker Studio Support']","['Looker Studio', 'Google Sheets', 'Data Visualization', 'Dashboard', 'SQL', 'Data Analytics & Visualization Software', 'Data Analytics', 'Database Management', 'Data Analysis', 'Analytics Dashboard', 'Data Science', 'Data Analysis Consultation', 'Interactive Data Visualization', 'Supermetrics', 'Google Analytics Report']"
34,Data analyst & R / Rshiny Expert,$35.00/hr,"***********************I shall either find a way or make it one********************

I'm an Engineer in Operational Research  , I've got many skills and expertise that will allow me to achieve perfectly all the projects and missions. I have advanced knowledge's in: 
Vba Excel  Optimization Queuing Theory Linear Programming  Economics modeling, Data Mining: Factor analysis, Principal Component Analysis, Regression (Simple, Multiple, logistic, hierarchical, Poisson), Anova, Clustering, Hierarchical Clustering... 
I master Lingo, Ampl, Spss, Stata, R, Eviews, I'll provide you perfect reporting using MsWord.
Also I have a huge experience / Knowledge with creating software for scraping/extracting data from web site with VBNET",20,421,El Aiun,Morocco,100,"['ECL for receivables - Phase 2', 'R kmax', 'R works / Shiny R works', 'CVCosmos Web Platform, Data Mining & Machine Learning codes development + Marketing Strategy', 'Forecast air pollution model', 'New Contract', 'Receivables ECL Phase 3', 'Minor tweaks in ecl for receivables', 'ECL for Receivables - Roll rate method', 'R works contract', 'Traffic model :air and noise pollution', 'Expert Shiny IO Programmer and App Modifier', 'R support', 'Trend analysis in a health data set using R']","['Data Mining', 'pandas', 'R', 'Python', 'Data Scraping', 'Statistical Programming', 'Statistics', 'R Shiny', 'Big Data', 'Stata', 'Django', 'API Integration', 'Machine Learning', 'Marketing Analytics']"
35,Mathematician/Data Analyst/Data Scientist,$12.00/hr,"Experienced Mathematics Instructor & Data Analyst with Google & IBM certifications. Proficient in SQL, Python, R, Excel, Tableau, and Power BI. Strong analytical skills in data visualization, cleaning, analysis, and report generation. Over 3 years in machine learning, focusing on Python with expertise in key libraries like NumPy, Pandas, sci-kit-learn, TensorFlow, and Keras.
I am all set to offer optimal solutions to individuals and companies, drawing upon my skills and extensive experience, to address their business needs effectively.
Regards
Irfan",19,821,Islamabad,Pakistan,100,"['Revenue Management', 'Visualization table', 'Revenue Manager PriceLabs', 'Need Data Analyst', 'mathematician', 'Data analytics', 'Data Analyst - Tableau and SQL', 'Data Analysis - Cleaning & Cooking of Raw Data', 'Mathematician', 'Cleaning data in Sheets for CSV to MySQL import', 'Google Data Analytics Professional Certificate Companion Guide Development']","['Statistics', 'Mathematics', 'Python', 'Tableau', 'R', 'Machine Learning', 'Data Analysis', 'Data Modeling', 'Microsoft Power BI', 'Business Intelligence', 'Data Analytics', 'Data Cleaning', 'Data Analytics & Visualization Software', 'SQL', 'SQLite']"
36,PhD| Statistics| Econometrics| Data Science/Analysis| Machine Learning,$100.00/hr,"🏆 EXPERT-VETTED TOP 1% ON UPWORK |⭐ 5-Star Ratings | Data Analytics and Predictive Modeling|💎MASTER/PHD THESIS Help |✅Statistics, Panel Data, Time series Econometrics |✅ R, PYTHON, SAS, Tableau, Power BI | ✅Data Science, Machine Learning Models | ✅STATA Master, Large Survey Data and Regression Analysis, Economic Policy Evaluation, Predictive Financial Modeling | 🏆PhD and 20 years of experience.

ABOUT ME:
🏆 EXPERT-VETTED and TOP RATED status (TOP 1% TIER on UPWORK)
🥇20-year of working experience with large corporations and institutions (Amazon, the World Bank, International Financial Corporation, University of Pennsylvania) 
🎓PhD/Professor in Econometrics/Statistics/Data Science
💎Provide effective help for MASTER/PHD THESIS

With proven tracked records of success in Upwork (Expert Vetted Top 1% and Top rated), overwhelmingly positive feedback with 5* ratings, my PhD and 20 years of experience, I can definitely help you bring out the highest quality, great results for your project and achieve your business goals. 

I have over 20 years of experience in empirical research, statistical analysis, econometric modeling, data science, machine learning models, data analysis (panel data analysis and time series analysis, complex survey design and analysis), data visualization, storytelling, and project management. I enjoy creating dashboards of data analytics to provide data insights, data trend, meaningful graphs, statistical analysis, story-telling summary that serves as key benchmark to influence business decision. 
Moreover, I also provide robust statistical evidence, regression/correlation analysis, machine learning predictive models to provide supportive and significant results for business projects. 
I also help clients understand different statistical techniques, regression techniques, learn excellent statistical language including STATA, SAS, R, and Python to make your life easier. 

My previous projects on machine learning and econometric modeling include the followings but not limited to:
-      Data Analysis, Large Survey Data Analytics and Data Visualization.
-	Linear regression with panel data and time series data.
-	Forecasting model for time series analysis
-      Financial modeling such as stock returns, cryptocurrency price prediction, financial indices and financial performance prediction. 
-     Machine Learning models: Random forest, decision trees, KNN, neural network,...
-	Logistic models, multinomial logit models, ordered logit models.
-	Economics research, market research, house price, mortgage default prediction, 
-	Program evaluation using different methods such as difference in difference, propensity score matching, instrument variables, fixed effects, regression discontinuity design.
I am happy to share my knowledge on machine learning modeling as well as quantitative and analytical skills to help you succeed in your project.

In addition, with my experience in participating and presenting in thousands of academic and industry conferences, supervising and guiding hundreds of college and graduate students in their thesis/dissertation, I am very confident that I can help you make a difference in your project and bring out the highest quality and great results for your Master or PhD's thesis/dissertation project.

I can also provide statistical advice and statistical analysis including:
-	Descriptive Statistics.
-	Bi-variate analyses such as t-tests, correlations, chi-square tests and non-parametric tests for normal and non-normal data.
-	Multivariate analyses such as ANOVA, MANOVA, LDA, PCA and factoring analysis, regression analysis (see econometric models above).
-	Review and interpret statistical output, set up the appropriate hypothesis testing and write up conclusion and policy recommendation.
-	Tutoring Statistics, Math and Econometric courses: including both introduction and advanced courses. 

I have experience with different types of data including:
-	Survey data (household, market research, firm/business/country data, house price, loan performance, accounting, finance, health, labor and income, etc.)   
-	Panel data
-	Time series data 
I help clients put together and analyze different types of survey data, panel and time series data, getting the data insights, build data trend and data stories with meaningful graphs and great visualization. 

With proven tracked records of success in Upwork (Expert Vetted Top 1% and Top rated), overwhelmingly positive feedback with 5* ratings, my PhD and 20 years of experience, I can definitely help you bring out the highest quality, great results for your project and achieve your business goals. 

Looking forward to working with you soon,
Dr. Victoria",207,54,Potomac,,96,"['Statistician needed for a Long-term Project in Statistical Analysis', 'MIT Research Study- Predictive Models, Statistics and Trend Analysis - Experts with R, Python, Stata', 'Data scientist & Econometric Expert for World Bank Survey Data Analysis and Modeling', 'Data Analytics/Time Series Model Predictive Modeling for Multifamily Real Estate Investment Scores', 'Quantitative Analysis of Economics Data Using R/Python and Econometric Models', 'Statistical Analysis and Quantitative Methodology Support for Thesis/Dissertation', 'Time Series Econometrics Modeling & Stata Analysis', 'Data Scientist - Predictive Machine Learning Model', 'Quant Machine Learning Expert Needed for Back-testing Trading Strategies', 'Harvard Review Study - Cash-flows Analysis and Econometrics Models of Firm Performance Index', 'Data Scientist Needed for Machine Learning Model Development', 'Stata Guru with Advanced Regression Analysis and Panel Data Analysis for Stock Return Estimation', 'Machine Learning Expert needed for CRE Predictive Modeling with Real Estate and Mortgage Knowledge', 'Build mortgage fund model', 'Help quality assure and refine a family office wealth model in Excel', 'Trading Algorithm Research & Development, Statistician, Market Research, Coaching and Training', 'Building Dynamic, Advanced Stata Programs for Automating and Optimizing Data Analysis', 'Stata data analytics tutoring', 'Real Estate Analytics & Statistical Analysis of Multifamily Investment Metrics', 'Difference-in-Differences Models and Propensity Score Matching Econometrics Methods.']","['R', 'Stata', 'Data Analysis', 'Data Science', 'SAS', 'Data Modeling', 'Econometrics', 'Quantitative Finance', 'Quantitative Analysis', 'Data Mining', 'Statistics', 'Microsoft Excel']"
37,Data Analyst | Statistician | Dashboard Creator| Power BI Developer,$10.00/hr,"Tools and Technologies:
☑ Power BI
☑ R-Studio
☑ Google Looker Studio
☑ Google Analytics
☑ Zapier
☑ Airtable
☑ Tableau
☑ Microsoft Excel
☑ Google Sheets
☑ Minitab
☑ SPSS
☑ STATA
☑ Curve Expert Professional


I'm an experienced, disciplined and highly motivated statistician/data analyst who provides solutions for business problems with the help of data. I've done MS in Statistics, specializing in data visualization, exploratory data analysis and data modeling. 

I can create automated and interactive reports, dashboards using  Microsoft Excel, Google Sheets, Google Data Studio, Power BI, Rstudio and Tableau. Depending upon the requirements, I can write queries in Power Query Editor and create pivot tables/charts as well

During my career, I worked on a wide range of projects. I worked on KPI reports, Sales  and Revenue Reports, Team Performance reports, Capability Analysis, Project Plan, Forecasting, A/B testing of application and creating bugs/issues reports, analyzed publicly available data of various companies as per client's request. I have a strong background in utilizing Statistical Quality Control Techniques, Regression and Correlation Analysis, Forecasting, Survey Data Analysis and Hypothesis Testing.

Business Analytics experience by utilizing R-studio, Power BI, Tableau and Google Data Studio to make large and complex data more understandable and usable.

In addition to my technical skills, my strengths lie in providing meaningful insights through data analysis and communicating data insights that can solve problems of business teams and relevant stakeholders.

Further, I assure you of accurate and on-time delivery and 100% commitment to the job.",46,867,Islamabad,Pakistan,100,"['Data Analytics and Dashboards', 'PowerBI Expert', 'Power BI Dashboard Development', 'Simple data cleanup and report building according to template', 'spss sheet prepare', 'You will get a Google Data Studio Dashboard and Reports', 'Business Intelligence Application Development', 'ML Classification Model for Arbitrage Trading - Graph Recognition', 'Data Analytics Specialist', 'Test Project_Excel Expert Required for Planning Analyst Role', 'Power BI dashboard', 'Tutor', 'Power BI report', 'Data Analysis and Data Visualization', 'Sales FC Data Integration Project (Google Storage x Looker Studio)', 'Excel Spreadsheet', 'Power BI Dashboards for CapYear Academy', 'Biostatistics Tutor with expertise in R and Stata for Live Sessions', 'Rstudio Consultation', 'Scout_Data_Analysis_Feb_2023']","['Microsoft Power BI', 'Google Sheets', 'Looker Studio', 'Microsoft Excel', 'Dashboard', 'IBM SPSS', 'Data Visualization', 'Microsoft Power BI Data Visualization', 'Data Analysis', 'Statistics', 'RStudio', 'Data Cleaning', 'Data Modeling', 'Marketing Analytics', 'Google Docs']"
38,Data Analyst | Power BI | Excel Expert | Visualizations | Google Sheet,$50.00/hr,"IBM & Google Certified Data Analyst and Software Engineer, with a 5+ years of experience in data analytics, business intelligence (BI), and data visualization. Specializing in Python, Power BI, Tableau, SQL, Excel, leveraging data for business growth, cost reduction, and profit enhancement. 

I turn complex data into clear, actionable insights to enhance decision-making.

My data analysis & Business intelligence toolkit includes:
- Microsoft Excel
- Microsoft Power BI
- Salesforce Tableau
- Google Looker Studio
- Google Sheets
- Smartsheet
- Python & R Statistical analytics
- ETL pipelines & solutions for MySQL, MS SQL Server, PostgreSQL, MariaDB databases

Skills:
● Python, R, Power BI, Tableau, Excel and SQL for deep data insights, advanced data analysis, visualization, and reporting
● Creating BI solutions with Power BI and Tableau, focusing on data-driven strategies for business optimization
● Automating data processes, data cleaning, and optimization with SQL, DAX, and Power Query
● Excel and Google Sheets for data manipulation, analysis, and presentation; skilled in VBA, Macros, Pivot Tables, and complex formulas.

Professional Services:
● Specialized analysis and reporting for Real Estate (Zillow, Realtor etc), HR, and Finance industries using SQL, Python, and BI tools
● Expert in crafting data dashboards and reports in Power BI, Tableau, Excel, highlighting KPIs, trends, and insights.
● Specializes in comprehensive survey analysis,  designing and interpreting surveys, utilizing leading survey platforms such as Qualtrics, SurveyMonkey, and Google Forms. I apply statistical methods for survey data, including segmentation analysis, cross-tabulation, and sentiment analysis, to extract meaningful insights that guide strategic decision-making

Excel & BI Analytics Specialization:
● Designing custom Excel & Google Sheets templates tailored for enhanced data analysis and presentation.
● Developing comprehensive & insightful dashboards in Excel, Power BI for financial modeling, survey analysis, and business intelligence.
● Advanced expertise in Excel for data validation, cleaning, and analysis, ensuring data integrity and actionable insights to facilitate complex data handling.

Feel free to reach out for best services & to discuss your project in details.",34,116,Islamabad,Pakistan,100,"['BI Dashboard Consultation Call', 'Excel + Sheets Design + Computation', 'Spread Sheet Data Analyst and Dashboard Creation', 'Excel HR Succession Planning Tool', 'Google Sheet Charts', 'Spread Sheet Data Analyst and Dashboard Creation', 'Survey Results Data Manipulation Assignment', 'Data Analyst - Tableau and SQL', 'Spreadsheet with Data Analysis into Power Bi', ""Real Estate Data Excel Spreadsheet and Power Bi Master Dashboard with KPI's"", 'Development of Tools to Create Plan', 'Google Sheet Expert for Checklist Upgrade', 'Graphic Optimization and Data Visualization', 'Data Analyst to create growth graph for presentation with Google Sheets', 'Excel Dashboard', 'PowerBi - Dasboards and Articles', 'Net Effective Rent Calculation Tool - Commercial Leasing', 'Job Sheet Re-Fresher', 'NEED QUICK STATS FROM QUERIES (MS-ACCESS OR SQLServer)', 'Create formulas in Google Sheets']","['Data Analytics', 'Data Cleaning', 'Data Visualization', 'SQL', 'Data Analysis', 'Exploratory Data Analysis', 'Dashboard', 'Microsoft Excel', 'Microsoft Power BI', 'Survey Data Analysis', 'Google Sheets', 'Analytics Dashboard', 'Microsoft Power BI Data Visualization', 'Microsoft Power BI Development', 'Google Sheets Automation']"
39,"Data Analysis, Data Visualization, AI Developer & Automations Expert",$19.99/hr,"⭕Upwork Top 10% Freelancer⭕  ⭕180+ Successful Projects⭕  ⭕100% Customer Satisfaction⭕


🔍 Excel/ Power Bi Maestro: With over 10 years of experience, I excel in leveraging Excel's power for data manipulation and organization, seamlessly integrating Python for scraping tasks and data extraction.

📈 Visualization Wizard: Transforms raw data into compelling visual narratives for informed decision-making, employing Excel, Python, and data visualization tools like Power BI and Tableau to showcase insights gleaned from scraped data.

📊 Data Analysis/ Data Scraping Aficionado: A seasoned data analysis professional adept at extracting actionable insights from complex datasets using Excel, Python, and statistical analysis techniques, including data scraped from various sources.

💼 Automation Guru: With a track record of over a decade, I specialize in creating seamless automated processes for enhanced productivity, integrating Python, scraping, and Excel to deliver efficient solutions tailored to your needs.",193,891,Haripur,Pakistan,97,"['Google Data Studio/Looker/ Power BI Expert', 'Create Excel sheet for timetable creation', 'Looker Expert Needed for Data Visualization and Analysis', 'Revise powerbi dashboard', 'Power Query Expert', 'Powerbi Dashboarding', 'Excel Report', 'Power BI Expert Needed', 'Google Sheets Scripting Needed', 'Remittance Research - Pakistan', 'Data Analyst - App Sheet Expert', 'DPO check automation', 'Fleet Management dashboard xls', 'Power Bi Tutor (Live Session)', 'Google Form Setup and Dashboard Reporting', 'Excel', 'Vendor Analysis Checklist template in Excel / google sheets', 'Google sheet for tracking of sales', 'Revamp Code, Separate access for Zenrow', 'Cards - Pakistan']","['Microsoft Excel', 'Microsoft Power BI', 'Dashboard', 'Data Visualization', 'Google Sheets', 'Macros', 'Data Analysis', 'Automation', 'Web Scraping', 'Looker Studio', 'Script', 'Microsoft Power Automate', 'Python', 'AI Bot', 'API Integration']"
